{
  "$schema": "https://json-schema.org/draft/2020-12/schema",
  "$id": "https://aegissec.local/schemas/vulnerability-intelligence.schema.json",
  "title": "AegisSec Vulnerability Intelligence Result",
  "type": "object",
  "required": ["schema_version", "generated_at", "component_count", "finding_count", "findings"],
  "properties": {
    "schema_version": {"type": "string"},
    "generated_at": {"type": "string"},
    "engine": {"type": "string"},
    "component_count": {"type": "integer", "minimum": 0},
    "finding_count": {"type": "integer", "minimum": 0},
    "sources": {"type": "object", "additionalProperties": {"type": "boolean"}},
    "warnings": {"type": "array", "items": {"type": "string"}},
    "findings": {
      "type": "array",
      "items": {
        "type": "object",
        "required": ["id", "identifiers", "intelligence"],
        "properties": {
          "id": {"type": "string"},
          "summary": {"type": ["string", "null"]},
          "fixed_versions": {"type": "array", "items": {"type": "string"}},
          "identifiers": {
            "type": "object",
            "required": ["cve", "ghsa", "osv", "other"],
            "properties": {
              "cve": {"type": "array", "items": {"type": "string"}},
              "ghsa": {"type": "array", "items": {"type": "string"}},
              "osv": {"type": "array", "items": {"type": "string"}},
              "other": {"type": "array", "items": {"type": "string"}}
            }
          },
          "intelligence": {"type": "object"},
          "assessment": {"type": "object"}
        }
      }
    }
  }
}
